{
  "timestamp": "2025-07-31T08:32:10+00:00",
  "framework_version": "2.0",
  "git_commit": "c9656ef",
  "mapping_sha256_before": "3d315376d462495495960d4224da63b5bc2a05429d6876b3a4718a90e14e579d",
  "mapping_sha256_after": "df967aaa42b746128beb83863e0e965aab437bde65e86630f983218e14b51815",
  "category": "Framework V2 Test",
  "rationale": "Testing systematic improvement framework v2 functionality with safe mappings",
  "mappings_added": 2,
  "mappings": [
    [
      "뭠",
      "test1",
      "-0.5"
    ],
    [
      "똡",
      "test2",
      "-0.5"
    ]
  ],
  "baseline_performance": {
    "math_dataset": {
      "success": 691,
      "total": 733,
      "accuracy": 94.27,
      "parsed_line": "691/733 = 94.27% round‑trip"
    },
    "diverse_dataset": {
      "success": 194,
      "total": 200,
      "accuracy": 97.0,
      "parsed_line": "DIVERSE DATASET: 194/200 = 97.00%"
    },
    "independent_dataset": {
      "success": 153,
      "total": 165,
      "accuracy": 92.73,
      "parsed_line": "Overall Performance: 153/165 = 92.73%"
    }
  },
  "final_performance": {
    "math_dataset": {
      "success": 691,
      "total": 733,
      "accuracy": 94.27,
      "parsed_line": "691/733 = 94.27% round‑trip"
    },
    "diverse_dataset": {
      "success": 194,
      "total": 200,
      "accuracy": 97.0,
      "parsed_line": "DIVERSE DATASET: 194/200 = 97.00%"
    },
    "independent_dataset": {
      "success": 153,
      "total": 165,
      "accuracy": 92.73,
      "parsed_line": "Overall Performance: 153/165 = 92.73%"
    }
  },
  "statistical_analysis": {
    "math_dataset": {
      "wilson_lower_bound": 92.34541602752236,
      "wilson_upper_bound": 95.73323267374867
    },
    "diverse_dataset": {
      "wilson_lower_bound": 93.61057075454808,
      "wilson_upper_bound": 98.61796856598886
    },
    "independent_dataset": {
      "wilson_lower_bound": 87.7192538041669,
      "wilson_upper_bound": 95.79104099240843
    }
  },
  "improvement_summary": {
    "math_dataset": {
      "baseline": 94.27,
      "final": 94.27,
      "change": 0.0,
      "is_statistically_significant": false,
      "standard_error": 0.8584442128500352
    },
    "diverse_dataset": {
      "baseline": 97.0,
      "final": 97.0,
      "change": 0.0,
      "is_statistically_significant": false,
      "standard_error": 1.2062338081814818
    },
    "independent_dataset": {
      "baseline": 92.73,
      "final": 92.73,
      "change": 0.0,
      "is_statistically_significant": false,
      "standard_error": 2.0213213500084537
    }
  }
}